{
  "schema_version": "0.2.0",
  "generated_on": "2026-01-05",
  "scope": "Magnets wedge: EM + micromagnetics + thermo + structural + materials discovery. CLI/container-first.",
  "core_principles": [
    "Physics-first: nodes represent physical questions, tools are implementations.",
    "Multi-fidelity: always start at lowest-cost method that meets uncertainty targets.",
    "Closed-loop: every run produces standardized KPIs + uncertainty + provenance.",
    "Failure-aware: failed runs are classified and used to update constraints/priors."
  ],
  "ontology": {
    "kpis": {
      "field": {
        "B_roi_mean_T": {
          "type": "float",
          "unit": "T"
        },
        "B_roi_std_T": {
          "type": "float",
          "unit": "T"
        },
        "field_homogeneity_ppm": {
          "type": "float",
          "unit": "ppm"
        },
        "stray_field_max_T": {
          "type": "float",
          "unit": "T"
        }
      },
      "motor": {
        "torque_mean_Nm": {
          "type": "float",
          "unit": "N*m"
        },
        "torque_ripple_pct": {
          "type": "float",
          "unit": "%"
        },
        "back_emf_Vrms": {
          "type": "float",
          "unit": "V"
        },
        "loss_core_W": {
          "type": "float",
          "unit": "W"
        },
        "loss_magnet_W": {
          "type": "float",
          "unit": "W"
        },
        "loss_copper_W": {
          "type": "float",
          "unit": "W"
        },
        "efficiency_pct": {
          "type": "float",
          "unit": "%"
        }
      },
      "thermal": {
        "T_hotspot_C": {
          "type": "float",
          "unit": "C"
        },
        "T_roi_max_C": {
          "type": "float",
          "unit": "C"
        },
        "time_to_limit_s": {
          "type": "float",
          "unit": "s"
        }
      },
      "demag": {
        "demag_margin_min": {
          "type": "float",
          "unit": "dimensionless"
        },
        "demag_volume_pct": {
          "type": "float",
          "unit": "%"
        },
        "H_int_min_Apm": {
          "type": "float",
          "unit": "A/m"
        },
        "HcJ_min_Apm": {
          "type": "float",
          "unit": "A/m"
        }
      },
      "micromagnetics": {
        "Hc_Apm": {
          "type": "float",
          "unit": "A/m"
        },
        "Br_T": {
          "type": "float",
          "unit": "T"
        },
        "BHmax_kJm3": {
          "type": "float",
          "unit": "kJ/m^3"
        },
        "loop_area_Jm3": {
          "type": "float",
          "unit": "J/m^3"
        },
        "switching_field_std_Apm": {
          "type": "float",
          "unit": "A/m"
        }
      },
      "structural": {
        "sigma_vm_max_MPa": {
          "type": "float",
          "unit": "MPa"
        },
        "sigma_1_max_MPa": {
          "type": "float",
          "unit": "MPa"
        },
        "disp_max_mm": {
          "type": "float",
          "unit": "mm"
        },
        "sf_min": {
          "type": "float",
          "unit": "dimensionless"
        }
      },
      "materials": {
        "Ms_muB_per_fu": {
          "type": "float",
          "unit": "muB/f.u."
        },
        "MAE_meV_per_fu": {
          "type": "float",
          "unit": "meV/f.u."
        },
        "deltaE_hull_meV_per_atom": {
          "type": "float",
          "unit": "meV/atom"
        },
        "Tc_K": {
          "type": "float",
          "unit": "K"
        }
      }
    },
    "run_status": [
      "success",
      "failed",
      "partial"
    ],
    "failure_classes": [
      "non_convergence",
      "mesh_quality",
      "time_step_instability",
      "material_model_invalid",
      "out_of_domain",
      "license_or_env",
      "unknown"
    ]
  },
  "contracts": {
    "artifact_layout": {
      "inputs_dir": "inputs/",
      "outputs_dir": "outputs/",
      "logs_dir": "logs/",
      "run_metadata": "run.json",
      "results": "results.json",
      "provenance": "provenance.json"
    },
    "run_json_minimum": {
      "run_id": "uuid",
      "problem_node_id": "string",
      "implementation_id": "string",
      "parameters": "object",
      "resources_requested": {
        "cpu_cores": "int",
        "gpu": "bool",
        "memory_gb": "float"
      },
      "budgets": {
        "max_wall_s": "int",
        "max_cost_units": "float"
      },
      "inputs": [
        "list of relative paths"
      ],
      "expected_outputs": [
        "list of relative paths"
      ]
    },
    "results_json_minimum": {
      "status": "success|failed|partial",
      "tool": {
        "name": "string",
        "version": "string"
      },
      "kpis": "object",
      "uncertainty": {
        "method": "string",
        "confidence": "float",
        "intervals": "object"
      },
      "artifacts": {
        "fields": [],
        "plots": [],
        "tables": []
      },
      "failure": {
        "class": "string",
        "message": "string",
        "hints": [
          "string"
        ]
      }
    }
  },
  "physics_graph": {
    "problem_nodes": [
      {
        "id": "P4_field_homogeneity",
        "name": "Magnet assembly field strength & homogeneity",
        "taxonomy_refs": [
          "4"
        ],
        "requires": [
          {
            "physics_domain": "electromagnetics",
            "type": "magnetostatics"
          }
        ],
        "inputs": [
          "geometry",
          "materials.BH_curves",
          "magnet_properties.Br(T),HcJ(T)",
          "roi_definition"
        ],
        "outputs": [
          "field.B_roi_mean_T",
          "field.field_homogeneity_ppm",
          "field.stray_field_max_T"
        ],
        "acceptance": {
          "field.field_homogeneity_ppm": {
            "lte": 5000
          }
        },
        "fidelity_ladder": [
          "I_femm_2d",
          "I_elmer_3d_coarse",
          "I_elmer_3d_refined"
        ]
      },
      {
        "id": "P6_demag_derating",
        "name": "Coupled EM-thermal demagnetization derating",
        "taxonomy_refs": [
          "6"
        ],
        "requires": [
          {
            "physics_domain": "electromagnetics",
            "type": "eddy_currents"
          },
          {
            "physics_domain": "thermal",
            "type": "heat_transfer"
          }
        ],
        "inputs": [
          "geometry",
          "drive_cycle",
          "cooling_BCs",
          "magnet_properties.HcJ(T),Br(T)",
          "loss_models"
        ],
        "outputs": [
          "thermal.T_hotspot_C",
          "demag.demag_margin_min",
          "demag.demag_volume_pct"
        ],
        "acceptance": {
          "demag.demag_margin_min": {
            "gte": 0.15
          }
        },
        "fidelity_ladder": [
          "I_elmer_em_coarse_plus_lumped_thermal",
          "I_elmer_em_thermal_iterated",
          "I_elmer_em_thermal_plus_cfd"
        ]
      },
      {
        "id": "P2_coercivity_mechanisms",
        "name": "Microstructure \u2192 coercivity & switching distribution",
        "taxonomy_refs": [
          "2"
        ],
        "requires": [
          {
            "physics_domain": "micromagnetics",
            "type": "hysteresis"
          }
        ],
        "inputs": [
          "microstructure.grain_map",
          "params.Ms,K1,A,alpha",
          "temperature"
        ],
        "outputs": [
          "micromagnetics.Hc_Apm",
          "micromagnetics.switching_field_std_Apm"
        ],
        "acceptance": {
          "micromagnetics.Hc_Apm": {
            "gte": 800000
          }
        },
        "fidelity_ladder": [
          "I_mumax_gpu_sweep",
          "I_oommf_cpu_validation"
        ]
      }
    ],
    "implementations": [
      {
        "id": "I_femm_2d",
        "tool_id": "femm",
        "capabilities": [
          "magnetostatics",
          "force_torque",
          "2d_screening"
        ],
        "fidelity": {
          "tier": "T0",
          "expected_error_pct": 20,
          "typical_wall_s": 10
        },
        "runner": {
          "command": "femm.exe -lua-script={script}",
          "inputs": [
            "inputs/model.lua"
          ],
          "outputs": [
            "outputs/kpis.csv"
          ]
        },
        "hardware": {
          "cpu_cores": 1,
          "gpu": false,
          "memory_gb": 1
        }
      },
      {
        "id": "I_elmer_3d_coarse",
        "tool_id": "elmer",
        "capabilities": [
          "magnetostatics",
          "nonlinear_mu",
          "3d"
        ],
        "fidelity": {
          "tier": "T1",
          "expected_error_pct": 8,
          "typical_wall_s": 600
        },
        "runner": {
          "command": "ElmerSolver inputs/model.sif > logs/elmer.log 2>&1",
          "inputs": [
            "inputs/model.sif",
            "inputs/mesh/"
          ],
          "outputs": [
            "outputs/fields.vtu"
          ]
        },
        "hardware": {
          "cpu_cores": 8,
          "gpu": false,
          "memory_gb": 16
        }
      },
      {
        "id": "I_elmer_3d_refined",
        "tool_id": "elmer",
        "capabilities": [
          "magnetostatics",
          "nonlinear_mu",
          "3d",
          "refinement"
        ],
        "fidelity": {
          "tier": "T2",
          "expected_error_pct": 3,
          "typical_wall_s": 7200
        },
        "runner": {
          "command": "ElmerSolver inputs/model.sif > logs/elmer.log 2>&1",
          "inputs": [
            "inputs/model.sif",
            "inputs/mesh/"
          ],
          "outputs": [
            "outputs/fields.vtu"
          ]
        },
        "hardware": {
          "cpu_cores": 32,
          "gpu": false,
          "memory_gb": 64
        }
      },
      {
        "id": "I_elmer_em_coarse_plus_lumped_thermal",
        "tool_id": "elmer",
        "capabilities": [